{
  "format": "aipackaging.polygon_draft",
  "version": 1,
  "metadata": {
    "sourceKind": "untitled",
    "sourceIdentifier": "",
    "savedAtUtc": "2026-10-01T00:00:00Z",
    "generation": 1,
    "baseFingerprint": null
  },
  "nextEntityId": 11,
  "document": {
    "problemId": "editor-demo-open-path",
    "sheet": {"entityId": 1, "width": 300.0, "height": 200.0, "unit": "mm"},
    "manufacturing": {"sheetMargin": 5.0, "partSpacing": 2.0, "kerf": 0.0, "curveTolerance": 0.05},
    "parts": [
      {
        "entityId": 2,
        "partId": "open-bezier",
        "quantity": 1,
        "outer": {
          "entityId": 3,
          "closed": false,
          "vertices": [
            {"entityId": 4, "x": 10.0, "y": 10.0},
            {"entityId": 5, "x": 90.0, "y": 10.0},
            {"entityId": 6, "x": 90.0, "y": 70.0}
          ],
          "segments": [
            {"entityId": 7, "type": "line"},
            {
              "entityId": 8,
              "type": "cubic_bezier",
              "control1": {"entityId": 9, "x": 110.0, "y": 25.0},
              "control2": {"entityId": 10, "x": 110.0, "y": 55.0}
            }
          ]
        },
        "holes": [],
        "allowedRotations": [0, 90]
      }
    ],
    "objective": {"type": "minimize_used_length", "version": 1}
  }
}
